//UC1: Create database address_book_service

Enter password: ***********
Welcome to the MySQL monitor.  Commands end with ; or \g.
Your MySQL connection id is 17
Server version: 8.0.31 MySQL Community Server - GPL

Copyright (c) 2000, 2022, Oracle and/or its affiliates.

Oracle is a registered trademark of Oracle Corporation and/or its
affiliates. Other names may be trademarks of their respective
owners.

Type 'help;' or '\h' for help. Type '\c' to clear the current input statement.

mysql> create database address_book_service;
Query OK, 1 row affected (0.01 sec)

mysql> show databases;
+---------------------------+
| Database                  |
+---------------------------+
| address_book_service      |
| address_book_system       |
| addressbookservice        |
| addressbooksystem         |
| blz                       |
| employee_payroll_service  |
| employee_payroll_services |
| information_schema        |
| mysql                     |
| payroll_service           |
| payroll_services          |
| performance_schema        |
| sys                       |
+---------------------------+
13 rows in set (0.00 sec)

mysql> use address_book_service;
Database changed

*********************************************************************************************

//UC2: Ability to create a Address Book Table with first and last names, address, city,state, zip, phone number and email as its attributes

mysql> create table addressbook(
    -> firstName varchar(30) not null,
    -> lastName varchar(30) not null,
    -> address varchar(100) not null,
    -> city varchar(25) not null,
    -> state varchar(30) not null,
    -> zipCode int not null,
    -> phoneNumber varchar(20) not null,
    -> email varchar(50) not null);
Query OK, 0 rows affected (0.03 sec)

mysql> desc addressbook;
+-------------+--------------+------+-----+---------+-------+
| Field       | Type         | Null | Key | Default | Extra |
+-------------+--------------+------+-----+---------+-------+
| firstName   | varchar(30)  | NO   |     | NULL    |       |
| lastName    | varchar(30)  | NO   |     | NULL    |       |
| address     | varchar(100) | NO   |     | NULL    |       |
| city        | varchar(25)  | NO   |     | NULL    |       |
| state       | varchar(30)  | NO   |     | NULL    |       |
| zipCode     | int          | NO   |     | NULL    |       |
| phoneNumber | varchar(20)  | NO   |     | NULL    |       |
| email       | varchar(50)  | NO   |     | NULL    |       |
+-------------+--------------+------+-----+---------+-------+
8 rows in set (0.01 sec)

************************************************************************************************
//UC3: Ability to insert new Contacts to AddressBook

mysql> insert into addressbook(firstName,lastName,address,city,state,zipCode,phoneNumber,email)values('Poonam','lohar','shirol','Kolhapur','maharashtra',416103,'9876567867','poonam98@gmail.com');
Query OK, 1 row affected (0.01 sec)

mysql> insert into addressbook(firstName,lastName,address,city,state,zipCode,phoneNumber,email)values('Reema','desai','savlaj','sangli','maharashtra',416311,'9565456789','reema13@gmail.com');
Query OK, 1 row affected (0.00 sec)

mysql> insert into addressbook(firstName,lastName,address,city,state,zipCode,phoneNumber,email)values('Srushti','mane','Wadi','kolhapur','maharashtra',416103,'8978678767','srushti09@gmail.com');
Query OK, 1 row affected (0.00 sec)

mysql> select * from addressbook;
+-----------+----------+---------+----------+-------------+---------+-------------+---------------------+
| firstName | lastName | address | city     | state       | zipCode | phoneNumber | email               |
+-----------+----------+---------+----------+-------------+---------+-------------+---------------------+
| Poonam    | lohar    | shirol  | Kolhapur | maharashtra |  416103 | 9876567867  | poonam98@gmail.com  |
| Reema     | desai    | savlaj  | sangli   | maharashtra |  416311 | 9565456789  | reema13@gmail.com   |
| Srushti   | mane     | Wadi    | kolhapur | maharashtra |  416103 | 8978678767  | srushti09@gmail.com |
+-----------+----------+---------+----------+-------------+---------+-------------+---------------------+
3 rows in set (0.00 sec)

*************************************************************************************************

//UC4 : Ability to edit existing contact person using their name


mysql> update addressbook set address='sambhajiChowk' where firstName = 'Poonam';
Query OK, 1 row affected (0.00 sec)
Rows matched: 1  Changed: 1  Warnings: 0

mysql> select * from addressbook;
+-----------+----------+---------------+----------+-------------+---------+-------------+---------------------+
| firstName | lastName | address       | city     | state       | zipCode | phoneNumber | email               |
+-----------+----------+---------------+----------+-------------+---------+-------------+---------------------+
| Poonam    | lohar    | sambhajiChowk | Kolhapur | maharashtra |  416103 | 9876567867  | poonam98@gmail.com  |
| Reema     | desai    | savlaj        | sangli   | maharashtra |  416311 | 9565456789  | reema13@gmail.com   |
| Srushti   | mane     | Wadi          | kolhapur | maharashtra |  416103 | 8978678767  | srushti09@gmail.com |
+-----------+----------+---------------+----------+-------------+---------+-------------+---------------------+
3 rows in set (0.00 sec)

**************************************************************************************************

//UC5: Ability to delete a person using person's name

mysql> delete from addressbook where firstName = 'Reema';
Query OK, 1 row affected (0.01 sec)

mysql> select * from addressbook;
+-----------+----------+---------------+----------+-------------+---------+-------------+---------------------+
| firstName | lastName | address       | city     | state       | zipCode | phoneNumber | email               |
+-----------+----------+---------------+----------+-------------+---------+-------------+---------------------+
| Poonam    | lohar    | sambhajiChowk | Kolhapur | maharashtra |  416103 | 9876567867  | poonam98@gmail.com  |
| Srushti   | mane     | Wadi          | kolhapur | maharashtra |  416103 | 8978678767  | srushti09@gmail.com |
+-----------+----------+---------------+----------+-------------+---------+-------------+---------------------+
2 rows in set (0.00 sec)

****************************************************************************************************

//UC6: Ability to Retrieve Person belonging to a City or State from the Address Book

mysql> select * from addressbook;
+-----------+----------+---------------+----------+-------------+---------+-------------+---------------------+
| firstName | lastName | address       | city     | state       | zipCode | phoneNumber | email               |
+-----------+----------+---------------+----------+-------------+---------+-------------+---------------------+
| Poonam    | lohar    | sambhajiChowk | Kolhapur | maharashtra |  416103 | 9876567867  | poonam98@gmail.com  |
| Srushti   | mane     | Wadi          | kolhapur | maharashtra |  416103 | 8978678767  | srushti09@gmail.com |
+-----------+----------+---------------+----------+-------------+---------+-------------+---------------------+
2 rows in set (0.00 sec)

mysql> select * from addressbook where city='kolhapur' or state = 'maharashtra';
+-----------+----------+---------------+----------+-------------+---------+-------------+---------------------+
| firstName | lastName | address       | city     | state       | zipCode | phoneNumber | email               |
+-----------+----------+---------------+----------+-------------+---------+-------------+---------------------+
| Poonam    | lohar    | sambhajiChowk | Kolhapur | maharashtra |  416103 | 9876567867  | poonam98@gmail.com  |
| Srushti   | mane     | Wadi          | kolhapur | maharashtra |  416103 | 8978678767  | srushti09@gmail.com |
+-----------+----------+---------------+----------+-------------+---------+-------------+---------------------+
2 rows in set (0.00 sec)

*****************************************************************************************************

//UC7: Ability to understand the size of address book by City and State
- Here size indicates the count


mysql> insert into addressbook(firstName,lastName,address,city,state,zipCode,phoneNumber,email)values('Reema','desai','savlaj','sangli','maharashtra',416311,'9565456789','reema13@gmail.com');
Query OK, 1 row affected (0.00 sec)

mysql> insert into addressbook(firstName,lastName,address,city,state,zipCode,phoneNumber,email)values('Shivam','desai','shivkrupa','Tasgoan','maharashtra',416311,'6787650987','shivam13@gmail.com');
Query OK, 1 row affected (0.00 sec)

mysql> select * from addressbook;
+-----------+----------+---------------+----------+-------------+---------+-------------+---------------------+
| firstName | lastName | address       | city     | state       | zipCode | phoneNumber | email               |
+-----------+----------+---------------+----------+-------------+---------+-------------+---------------------+
| Poonam    | lohar    | sambhajiChowk | Kolhapur | maharashtra |  416103 | 9876567867  | poonam98@gmail.com  |
| Srushti   | mane     | Wadi          | kolhapur | maharashtra |  416103 | 8978678767  | srushti09@gmail.com |
| Reema     | desai    | savlaj        | sangli   | maharashtra |  416311 | 9565456789  | reema13@gmail.com   |
| Shivam    | desai    | shivkrupa     | Tasgoan  | maharashtra |  416311 | 6787650987  | shivam13@gmail.com  |
+-----------+----------+---------------+----------+-------------+---------+-------------+---------------------+
4 rows in set (0.00 sec)

mysql> select count(city) from addressbook where city='kolhapur';
+-------------+
| count(city) |
+-------------+
|           2 |
+-------------+
1 row in set (0.00 sec)

mysql> select count(state) from addressbook where state='maharashtra';
+--------------+
| count(state) |
+--------------+
|            4 |
+--------------+
1 row in set (0.00 sec)

*********************************************************************************************************

//UC8: Ability to retrieve entries sorted alphabetically by Person’s name for a given city

mysql> select * from addressbook where city ='kolhapur'order by firstName;
+-----------+----------+---------------+----------+-------------+---------+-------------+---------------------+
| firstName | lastName | address       | city     | state       | zipCode | phoneNumber | email               |
+-----------+----------+---------------+----------+-------------+---------+-------------+---------------------+
| Poonam    | lohar    | sambhajiChowk | Kolhapur | maharashtra |  416103 | 9876567867  | poonam98@gmail.com  |
| Srushti   | mane     | Wadi          | kolhapur | maharashtra |  416103 | 8978678767  | srushti09@gmail.com |
+-----------+----------+---------------+----------+-------------+---------+-------------+---------------------+
2 rows in set (0.01 sec)

***********************************************************************************************************

//UC9: Ability to identify each Address Book with name and Type.

mysql> update addressbook set addressbook_name = 'book1',addressbook_type = 'family'where firstName ='Poonam';
Query OK, 1 row affected (0.01 sec)
Rows matched: 1  Changed: 1  Warnings: 0

mysql> update addressbook set addressbook_name = 'book2',addressbook_type = 'friend' where firstName ='Srushti';
Query OK, 1 row affected (0.00 sec)
Rows matched: 1  Changed: 1  Warnings: 0

mysql> update addressbook set addressbook_name = 'book3',addressbook_type = 'friend' where firstName ='Reema';
Query OK, 1 row affected (0.01 sec)
Rows matched: 1  Changed: 1  Warnings: 0

mysql> update addressbook set addressbook_name = 'book4',addressbook_type = 'family' where firstName ='Shivam';
Query OK, 1 row affected (0.00 sec)
Rows matched: 1  Changed: 1  Warnings: 0

mysql> select * from addressbook;
+-----------+----------+---------------+----------+-------------+---------+-------------+---------------------+------------------+------------------+
| firstName | lastName | address       | city     | state       | zipCode | phoneNumber | email               | addressbook_name | addressbook_type |
+-----------+----------+---------------+----------+-------------+---------+-------------+---------------------+------------------+------------------+
| Poonam    | lohar    | sambhajiChowk | Kolhapur | maharashtra |  416103 | 9876567867  | poonam98@gmail.com  | book1            | family           |
| Srushti   | mane     | Wadi          | kolhapur | maharashtra |  416103 | 8978678767  | srushti09@gmail.com | book2            | friend           |
| Reema     | desai    | savlaj        | sangli   | maharashtra |  416311 | 9565456789  | reema13@gmail.com   | book3            | friend           |
| Shivam    | desai    | shivkrupa     | Tasgoan  | maharashtra |  416311 | 6787650987  | shivam13@gmail.com  | book4            | family           |
+-----------+----------+---------------+----------+-------------+---------+-------------+---------------------+------------------+------------------+
4 rows in set (0.00 sec)

**************************************************************************************************************

//UC10: Ability to get number of contact persons i.e. count by type

mysql> use address_book_service;
Database changed
mysql> select * from addressbook;
+-----------+----------+---------------+----------+-------------+---------+-------------+---------------------+------------------+------------------+
| firstName | lastName | address       | city     | state       | zipCode | phoneNumber | email               | addressbook_name | addressbook_type |
+-----------+----------+---------------+----------+-------------+---------+-------------+---------------------+------------------+------------------+
| Poonam    | lohar    | sambhajiChowk | Kolhapur | maharashtra |  416103 | 9876567867  | poonam98@gmail.com  | book1            | family           |
| Srushti   | mane     | Wadi          | kolhapur | maharashtra |  416103 | 8978678767  | srushti09@gmail.com | book2            | friend           |
| Reema     | desai    | savlaj        | sangli   | maharashtra |  416311 | 9565456789  | reema13@gmail.com   | book3            | friend           |
| Shivam    | desai    | shivkrupa     | Tasgoan  | maharashtra |  416311 | 6787650987  | shivam13@gmail.com  | book4            | family           |
+-----------+----------+---------------+----------+-------------+---------+-------------+---------------------+------------------+------------------+
4 rows in set (0.00 sec)

mysql> select addressbook_type,count(*) from addressbook group by addressbook_type;
+------------------+----------+
| addressbook_type | count(*) |
+------------------+----------+
| family           |        2 |
| friend           |        2 |
+------------------+----------+
2 rows in set (0.01 sec)

*******************************************************************************************************************